{
  "schema_version": "v0alpha1",
  "catalog": "INFORMATION_SCHEMA",
  "dialect": "googlesql",
  "target": {
    "kind": "emulator",
    "image": {
      "family": "gcr.io/cloud-spanner-emulator/emulator",
      "tag": "1.5.57",
      "digest": "sha256:4987860c9f8ecf1fffbbcdac115cb88cb9d1a42bd966c235a9ab843aea34fbd1",
      "platform": "linux/amd64"
    }
  },
  "observed_at": "2026-09-05T06:10:26.748817Z",
  "producer_source_sha256": "c807cce09460e44ab31fe148ced171713aa8e5802754eda29277d13fd57c18a5",
  "invocation_sha256": "394c27273867ee16446472b5131b47283bcdb06d902be6a30c98982a205aa676",
  "query": "SELECT TABLE_NAME, COLUMN_NAME, SPANNER_TYPE, ORDINAL_POSITION\nFROM INFORMATION_SCHEMA.COLUMNS\nWHERE TABLE_SCHEMA = 'INFORMATION_SCHEMA'\nORDER BY TABLE_NAME, ORDINAL_POSITION",
  "surface_sha256": "74894aba5bf3006fd3c85df5a1f1c2e14361bcb5c86424895623fb4ad80118a7",
  "columns": [
    {
      "table_name": "CHANGE_STREAMS",
      "column_name": "CHANGE_STREAM_CATALOG",
      "spanner_type": "STRING(MAX)",
      "ordinal_position": 1
    },
    {
      "table_name": "CHANGE_STREAMS",
      "column_name": "CHANGE_STREAM_SCHEMA",
      "spanner_type": "STRING(MAX)",
      "ordinal_position": 2
    },
    {
      "table_name": "CHANGE_STREAMS",
      "column_name": "CHANGE_STREAM_NAME",
      "spanner_type": "STRING(MAX)",
      "ordinal_position": 3
    },
    {
      "table_name": "CHANGE_STREAMS",
      "column_name": "ALL",
      "spanner_type": "BOOL",
      "ordinal_position": 4
    },
    {
      "table_name": "CHANGE_STREAM_COLUMNS",
      "column_name": "CHANGE_STREAM_CATALOG",
      "spanner_type": "STRING(MAX)",
      "ordinal_position": 1
    },
    {
      "table_name": "CHANGE_STREAM_COLUMNS",
      "column_name": "CHANGE_STREAM_SCHEMA",
      "spanner_type": "STRING(MAX)",
      "ordinal_position": 2
    },
    {
      "table_name": "CHANGE_STREAM_COLUMNS",
      "column_name": "CHANGE_STREAM_NAME",
      "spanner_type": "STRING(MAX)",
      "ordinal_position": 3
    },
    {
      "table_name": "CHANGE_STREAM_COLUMNS",
      "column_name": "TABLE_CATALOG",
      "spanner_type": "STRING(MAX)",
      "ordinal_position": 4
    },
    {
      "table_name": "CHANGE_STREAM_COLUMNS",
      "column_name": "TABLE_SCHEMA",
      "spanner_type": "STRING(MAX)",
      "ordinal_position": 5
    },
    {
      "table_name": "CHANGE_STREAM_COLUMNS",
      "column_name": "TABLE_NAME",
      "spanner_type": "STRING(MAX)",
      "ordinal_position": 6
    },
    {
      "table_name": "CHANGE_STREAM_COLUMNS",
      "column_name": "COLUMN_NAME",
      "spanner_type": "STRING(MAX)",
      "ordinal_position": 7
    },
    {
      "table_name": "CHANGE_STREAM_OPTIONS",
      "column_name": "CHANGE_STREAM_CATALOG",
      "spanner_type": "STRING(MAX)",
      "ordinal_position": 1
    },
    {
      "table_name": "CHANGE_STREAM_OPTIONS",
      "column_name": "CHANGE_STREAM_SCHEMA",
      "spanner_type": "STRING(MAX)",
      "ordinal_position": 2
    },
    {
      "table_name": "CHANGE_STREAM_OPTIONS",
      "column_name": "CHANGE_STREAM_NAME",
      "spanner_type": "STRING(MAX)",
      "ordinal_position": 3
    },
    {
      "table_name": "CHANGE_STREAM_OPTIONS",
      "column_name": "OPTION_NAME",
      "spanner_type": "STRING(MAX)",
      "ordinal_position": 4
    },
    {
      "table_name": "CHANGE_STREAM_OPTIONS",
      "column_name": "OPTION_TYPE",
      "spanner_type": "STRING(MAX)",
      "ordinal_position": 5
    },
    {
      "table_name": "CHANGE_STREAM_OPTIONS",
      "column_name": "OPTION_VALUE",
      "spanner_type": "STRING(MAX)",
      "ordinal_position": 6
    },
    {
      "table_name": "CHANGE_STREAM_TABLES",
      "column_name": "CHANGE_STREAM_CATALOG",
      "spanner_type": "STRING(MAX)",
      "ordinal_position": 1
    },
    {
      "table_name": "CHANGE_STREAM_TABLES",
      "column_name": "CHANGE_STREAM_SCHEMA",
      "spanner_type": "STRING(MAX)",
      "ordinal_position": 2
    },
    {
      "table_name": "CHANGE_STREAM_TABLES",
      "column_name": "CHANGE_STREAM_NAME",
      "spanner_type": "STRING(MAX)",
      "ordinal_position": 3
    },
    {
      "table_name": "CHANGE_STREAM_TABLES",
      "column_name": "TABLE_CATALOG",
      "spanner_type": "STRING(MAX)",
      "ordinal_position": 4
    },
    {
      "table_name": "CHANGE_STREAM_TABLES",
      "column_name": "TABLE_SCHEMA",
      "spanner_type": "STRING(MAX)",
      "ordinal_position": 5
    },
    {
      "table_name": "CHANGE_STREAM_TABLES",
      "column_name": "TABLE_NAME",
      "spanner_type": "STRING(MAX)",
      "ordinal_position": 6
    },
    {
      "table_name": "CHANGE_STREAM_TABLES",
      "column_name": "ALL_COLUMNS",
      "spanner_type": "BOOL",
      "ordinal_position": 7
    },
    {
      "table_name": "CHECK_CONSTRAINTS",
      "column_name": "CONSTRAINT_CATALOG",
      "spanner_type": "STRING(MAX)",
      "ordinal_position": 1
    },
    {
      "table_name": "CHECK_CONSTRAINTS",
      "column_name": "CONSTRAINT_SCHEMA",
      "spanner_type": "STRING(MAX)",
      "ordinal_position": 2
    },
    {
      "table_name": "CHECK_CONSTRAINTS",
      "column_name": "CONSTRAINT_NAME",
      "spanner_type": "STRING(MAX)",
      "ordinal_position": 3
    },
    {
      "table_name": "CHECK_CONSTRAINTS",
      "column_name": "CHECK_CLAUSE",
      "spanner_type": "STRING(MAX)",
      "ordinal_position": 4
    },
    {
      "table_name": "CHECK_CONSTRAINTS",
      "column_name": "SPANNER_STATE",
      "spanner_type": "STRING(MAX)",
      "ordinal_position": 5
    },
    {
      "table_name": "COLUMNS",
      "column_name": "TABLE_CATALOG",
      "spanner_type": "STRING(MAX)",
      "ordinal_position": 1
    },
    {
      "table_name": "COLUMNS",
      "column_name": "TABLE_SCHEMA",
      "spanner_type": "STRING(MAX)",
      "ordinal_position": 2
    },
    {
      "table_name": "COLUMNS",
      "column_name": "TABLE_NAME",
      "spanner_type": "STRING(MAX)",
      "ordinal_position": 3
    },
    {
      "table_name": "COLUMNS",
      "column_name": "COLUMN_NAME",
      "spanner_type": "STRING(MAX)",
      "ordinal_position": 4
    },
    {
      "table_name": "COLUMNS",
      "column_name": "ORDINAL_POSITION",
      "spanner_type": "INT64",
      "ordinal_position": 5
    },
    {
      "table_name": "COLUMNS",
      "column_name": "COLUMN_DEFAULT",
      "spanner_type": "STRING(MAX)",
      "ordinal_position": 6
    },
    {
      "table_name": "COLUMNS",
      "column_name": "DATA_TYPE",
      "spanner_type": "STRING(MAX)",
      "ordinal_position": 7
    },
    {
      "table_name": "COLUMNS",
      "column_name": "IS_NULLABLE",
      "spanner_type": "STRING(MAX)",
      "ordinal_position": 8
    },
    {
      "table_name": "COLUMNS",
      "column_name": "SPANNER_TYPE",
      "spanner_type": "STRING(MAX)",
      "ordinal_position": 9
    },
    {
      "table_name": "COLUMNS",
      "column_name": "IS_GENERATED",
      "spanner_type": "STRING(MAX)",
      "ordinal_position": 10
    },
    {
      "table_name": "COLUMNS",
      "column_name": "IS_HIDDEN",
      "spanner_type": "BOOL",
      "ordinal_position": 11
    },
    {
      "table_name": "COLUMNS",
      "column_name": "GENERATION_EXPRESSION",
      "spanner_type": "STRING(MAX)",
      "ordinal_position": 12
    },
    {
      "table_name": "COLUMNS",
      "column_name": "ON_UPDATE_EXPRESSION",
      "spanner_type": "STRING(MAX)",
      "ordinal_position": 13
    },
    {
      "table_name": "COLUMNS",
      "column_name": "IS_STORED",
      "spanner_type": "STRING(MAX)",
      "ordinal_position": 14
    },
    {
      "table_name": "COLUMNS",
      "column_name": "SPANNER_STATE",
      "spanner_type": "STRING(MAX)",
      "ordinal_position": 15
    },
    {
      "table_name": "COLUMNS",
      "column_name": "IS_IDENTITY",
      "spanner_type": "STRING(MAX)",
      "ordinal_position": 16
    },
    {
      "table_name": "COLUMNS",
      "column_name": "IDENTITY_GENERATION",
      "spanner_type": "STRING(MAX)",
      "ordinal_position": 17
    },
    {
      "table_name": "COLUMNS",
      "column_name": "IDENTITY_KIND",
      "spanner_type": "STRING(MAX)",
      "ordinal_position": 18
    },
    {
      "table_name": "COLUMNS",
      "column_name": "IDENTITY_START_WITH_COUNTER",
      "spanner_type": "STRING(MAX)",
      "ordinal_position": 19
    },
    {
      "table_name": "COLUMNS",
      "column_name": "IDENTITY_SKIP_RANGE_MIN",
      "spanner_type": "STRING(MAX)",
      "ordinal_position": 20
    },
    {
      "table_name": "COLUMNS",
      "column_name": "IDENTITY_SKIP_RANGE_MAX",
      "spanner_type": "STRING(MAX)",
      "ordinal_position": 21
    },
    {
      "table_name": "COLUMN_COLUMN_USAGE",
      "column_name": "TABLE_CATALOG",
      "spanner_type": "STRING(MAX)",
      "ordinal_position": 1
    },
    {
      "table_name": "COLUMN_COLUMN_USAGE",
      "column_name": "TABLE_SCHEMA",
      "spanner_type": "STRING(MAX)",
      "ordinal_position": 2
    },
    {
      "table_name": "COLUMN_COLUMN_USAGE",
      "column_name": "TABLE_NAME",
      "spanner_type": "STRING(MAX)",
      "ordinal_position": 3
    },
    {
      "table_name": "COLUMN_COLUMN_USAGE",
      "column_name": "COLUMN_NAME",
      "spanner_type": "STRING(MAX)",
      "ordinal_position": 4
    },
    {
      "table_name": "COLUMN_COLUMN_USAGE",
      "column_name": "DEPENDENT_COLUMN",
      "spanner_type": "STRING(MAX)",
      "ordinal_position": 5
    },
    {
      "table_name": "COLUMN_OPTIONS",
      "column_name": "TABLE_CATALOG",
      "spanner_type": "STRING(MAX)",
      "ordinal_position": 1
    },
    {
      "table_name": "COLUMN_OPTIONS",
      "column_name": "TABLE_SCHEMA",
      "spanner_type": "STRING(MAX)",
      "ordinal_position": 2
    },
    {
      "table_name": "COLUMN_OPTIONS",
      "column_name": "TABLE_NAME",
      "spanner_type": "STRING(MAX)",
      "ordinal_position": 3
    },
    {
      "table_name": "COLUMN_OPTIONS",